{
  "$schema": "./mainnet-build-verification.schema.json",
  "programId": "278CdXnmeUFSmNjwbmRQmHk87fP5XqGmtshk9Jwp8VdE",
  "binaryHash": "1a2a6be79b5dafd6e90d56625e444ff266a704d19a15cb71e00199f7bc88e677",
  "hashAlgorithm": "SHA-256",
  "buildCommand": "anchor build -- --features mainnet",
  "anchorVersion": "anchor-cli 0.31.1",
  "rustVersion": "rustc 1.89.0-nightly (3e674b06b 2025-05-23)",
  "solanaCliVersion": "solana-cli 2.1.22 (src:26944979; feat:1416569292, client:Agave)",
  "builtAt": "2026-05-11T05:23:00Z",
  "notes": "Mainnet release binary. Compare against deployed program binary using solana program dump."
}
